{
  "bayId": "bay_c3d4e5f6a7b8",
  "bayNumber": 3,
  "status": "Finishing",
  "previousStatus": "Occupied",
  "programs": [
    {
      "programNumber": 1,
      "available": false
    },
    {
      "programNumber": 2,
      "available": false
    },
    {
      "programNumber": 3,
      "available": false
    }
  ]
}
