{
  "bayId": "bay_a1b2c3d4e5f6",
  "bayNumber": 2,
  "status": "Available",
  "programs": [
    {
      "programNumber": 1,
      "available": true
    },
    {
      "programNumber": 2,
      "available": false,
      "errorCode": 5003,
      "errorText": "CONSUMABLE_SYSTEM"
    },
    {
      "programNumber": 3,
      "available": true
    }
  ]
}
